{"$schema":"https://json-schema.org/draft/2020-12/schema","$id":"lobster-dependency-graph/v2","type":"object","additionalProperties":false,"required":["schema","project","entries","nodes","edges","fingerprint","confidence"],"properties":{"schema":{"const":"lobster-dependency-graph/v2"},"project":{"type":"string"},"entries":{"type":"array","items":{"type":"string"}},"nodes":{"type":"array","items":{"type":"object","additionalProperties":false,"required":["path","sha256"],"properties":{"path":{"type":"string"},"sha256":{"pattern":"^[a-f0-9]{64}$"}}}},"edges":{"type":"array","items":{"type":"object","additionalProperties":false,"required":["from","to"],"properties":{"from":{"type":"string"},"to":{"type":"string"}}}},"fingerprint":{"pattern":"^[a-f0-9]{64}$"},"confidence":{"enum":["FULL","PARTIAL","CONSERVATIVE"]}}}
